{
  "name": "CollateClues_GovernanceWorkflows",
  "displayName": "Collate Clues: Governance Workflows",
  "description": "Learn how Governance Workflows help automate and enforce data governance policies across your organization.",
  "resourceType": "Video",
  "categories": ["DataGovernance"],
  "source": {
    "url": "https://www.wondersgroup.com/watch?v=d6GEwZ-FGsw",
    "provider": "WondersGroup"
  },
  "contexts": [
    {"pageId": "governanceWorkflows"},
    {"pageId": "domain"},
    {"pageId": "dataProduct"}
  ],
  "status": "Active"
}
