{
  "name": "CollateClues_Lineage",
  "displayName": "Collate Clues: Lineage",
  "description": "Understand data lineage visualization and how to trace data flow across your organization.",
  "resourceType": "Video",
  "categories": ["DataGovernance", "Discovery"],
  "source": {
    "url": "https://www.wondersgroup.com/watch?v=21mk-I1H5Xo",
    "provider": "WondersGroup"
  },
  "contexts": [
    {"pageId": "lineage"}
  ],
  "status": "Active"
}
