{
  "name": "CollateClues_DataProducts",
  "displayName": "Collate Clues: Data Products",
  "description": "Quick overview of Data Products in Collate - learn how to organize and manage your data assets as products.",
  "resourceType": "Video",
  "categories": ["DataGovernance", "Discovery"],
  "source": {
    "url": "https://www.wondersgroup.com/watch?v=-P7_qO1qYY4",
    "provider": "WondersGroup"
  },
  "contexts": [
    {"pageId": "dataProduct"},
    {"pageId": "domain"}
  ],
  "status": "Active"
}
