{
  "name": "CollateClues_Automations",
  "displayName": "Collate Clues: Automations",
  "description": "Discover how to automate data governance workflows and tasks in Collate.",
  "resourceType": "Video",
  "categories": ["DataGovernance", "Administration"],
  "source": {
    "url": "https://www.wondersgroup.com/watch?v=dJZ8wGAM-ek",
    "provider": "WondersGroup"
  },
  "contexts": [
    {"pageId": "automations"}
  ],
  "status": "Active"
}
