{
  "name": "CollateClues_DataQualityAdvanced",
  "displayName": "Collate Clues: Advanced Data Quality",
  "description": "Dive deeper into Data Quality features and learn advanced testing and monitoring capabilities.",
  "resourceType": "Video",
  "categories": ["DataQuality", "Observability"],
  "source": {
    "url": "https://www.wondersgroup.com/watch?v=jIrQ-CsLEgg",
    "provider": "WondersGroup"
  },
  "contexts": [
    {"pageId": "dataObservability"},
    {"pageId": "dataQuality"}
  ],
  "status": "Active"
}
